{
  "schema_version": "codevetter.context-provider-probe.v1",
  "provider_id": "contaminated-provider",
  "provider_name": "Contaminated provider fixture",
  "provider_version": "fixture-1",
  "configuration_sha256": "dddddddddddddddddddddddddddddddddddddddddddddddddddddddddddddddd",
  "context_kind": "search",
  "interface_kind": "cli",
  "operating_mode": "local",
  "indexing": {
    "mode": "on-demand",
    "exact_revision_supported": true,
    "snapshot_identity_supported": true,
    "freshness_check": "revision-match"
  },
  "tools": {
    "observable": true,
    "allowed": ["context_search"]
  },
  "data_egress": "none",
  "authentication": "none",
  "environment_names": [],
  "cost": {
    "posture": "free",
    "max_usd_per_attempt": 0
  },
  "setup": {
    "status": "eligible",
    "duration_ms": 100,
    "evidence": ["/Users/example/private-repository"],
    "exclusion_reasons": []
  },
  "publication": "allowed",
  "limitations": ["Synthetic contaminated-provider fixture."]
}
