{
  "schema_version": "codevetter.context-provider-probe.v1",
  "provider_id": "codevetter-structural-context",
  "provider_name": "CodeVetter structural context",
  "provider_version": "1.7.0",
  "configuration_sha256": "98df90f91250dbe8462446ea5096055922e30745afdccefeb412c8d723584336",
  "context_kind": "graph",
  "interface_kind": "cli",
  "operating_mode": "local",
  "indexing": {
    "mode": "on-demand",
    "exact_revision_supported": true,
    "snapshot_identity_supported": true,
    "freshness_check": "revision-match"
  },
  "tools": {
    "observable": true,
    "allowed": ["graph_query"]
  },
  "data_egress": "none",
  "authentication": "none",
  "environment_names": [],
  "cost": {
    "posture": "free",
    "max_usd_per_attempt": 0
  },
  "setup": {
    "status": "eligible",
    "duration_ms": null,
    "evidence": [
      "apps/desktop/src-tauri/examples/context_provider_fixture.rs:local-cli-adapter",
      "apps/desktop/src-tauri/src/commands/structural_graph/extract/engine.rs:tree-sitter-engine",
      "apps/desktop/src-tauri/src/commands/structural_graph/query/search.rs:graph-query",
      "apps/desktop/src-tauri/tauri.conf.json:version-1.7.0"
    ],
    "exclusion_reasons": []
  },
  "publication": "allowed",
  "limitations": [
    "The experiment exposes graph_query through a local CLI over the product graph engine; it does not measure MCP transport overhead."
  ]
}
